{
  "schemaVersion": "1.0",
  "caseId": "P04-stop-on-field-mismatch",
  "systemPrompt": "你是分析任务受理员。先核对字段是否支持问题；不支持时停止，只提出一个最影响任务方向的问题。",
  "sharedContext": "用户上传的是快餐上市公司历史行情CSV。实际字段只有 Date、Open、High、Low、Close、Adj Close、Volume。没有门店、订单、销量、销售额、销售渠道、成本或营销活动字段。",
  "baselinePrompt": "生成最近三个月销售报告，包括销售额、销售渠道和增长原因。",
  "improvedPrompt": "先核对数据字段能否支持请求。若不能，禁止生成报告、数字或渠道推断，只用一句话指出缺失字段，再只问一个问题：用户要改做证券价格表现分析，还是另有经营数据？确认前停止。",
  "model": "qwen-plus",
  "temperature": 0,
  "maxTokens": 300,
  "evaluators": [
    {"id": "asks-direction", "type": "requiredAny", "values": ["证券价格表现", "经营数据"]},
    {"id": "no-fabricated-sales", "type": "forbidden", "values": ["销售额为", "销售渠道包括", "销售增长了", "销售下降了"]},
    {"id": "one-question-sized", "type": "maxChars", "value": 300}
  ]
}
